{
  "$schema": "https://json-schema.org/draft/2020-12/schema",
  "$id": "https://sourceos.dev/schemas/grant-state-decision.v1.1.json",
  "title": "SourceOS Grant State Decision v1.1",
  "type": "object",
  "additionalProperties": false,
  "required": [
    "schema_version",
    "decision_kind",
    "decision_id",
    "ts_decided",
    "grant_ref",
    "subject_ref",
    "authority_decision",
    "decision_actor_ref",
    "authorization_policy_ref",
    "authorization_evidence_refs",
    "effective_at",
    "authority_effects",
    "source_policy_decision_ref",
    "restoration_allowed"
  ],
  "properties": {
    "schema_version": {"const": "1.1.0"},
    "decision_kind": {"const": "grant-state-decision"},
    "decision_id": {"type": "string", "minLength": 1},
    "ts_decided": {"type": "string", "format": "date-time"},
    "grant_ref": {"type": "string", "minLength": 1},
    "subject_ref": {"type": "string", "minLength": 1},
    "authority_decision": {"type": "string", "enum": ["unchanged", "reduced", "suspended", "revoked", "restored"]},
    "decision_actor_ref": {"type": "string", "minLength": 1},
    "authorization_policy_ref": {"type": "string", "minLength": 1},
    "authorization_evidence_refs": {"type": "array", "minItems": 1, "items": {"type": "string"}, "uniqueItems": true},
    "effective_at": {"type": "string", "format": "date-time"},
    "authority_effects": {
      "type": "object",
      "additionalProperties": false,
      "required": ["tool_access", "memory_access", "event_write", "bridge_export", "runtime_dispatch"],
      "properties": {
        "tool_access": {"type": "string", "enum": ["unchanged", "reduced", "suspended", "revoked", "restored"]},
        "memory_access": {"type": "string", "enum": ["unchanged", "reduced", "suspended", "revoked", "restored"]},
        "event_write": {"type": "string", "enum": ["unchanged", "reduced", "suspended", "revoked", "restored"]},
        "bridge_export": {"type": "string", "enum": ["unchanged", "reduced", "suspended", "revoked", "restored"]},
        "runtime_dispatch": {"type": "string", "enum": ["unchanged", "reduced", "suspended", "revoked", "restored"]}
      }
    },
    "source_policy_decision_ref": {"type": ["string", "null"]},
    "source_runtime_effect_decision_ref": {"type": ["string", "null"]},
    "restoration_allowed": {"type": "boolean"},
    "restoration_conditions": {"type": "array", "items": {"type": "string"}, "uniqueItems": true},
    "evidence_refs": {"type": "array", "items": {"type": "string"}, "uniqueItems": true},
    "explanation": {"type": "string"}
  }
}
